{
  "version": 1,
  "meta": {
    "org": "Lionscraft",
    "facility": "Sri Lanka Telecom Resilience Facility",
    "product": "Response-Linked ART",
    "revision": 1,
    "updated": "2026-08-08"
  },
  "partners": [
    {
      "id": "p01",
      "name": "Swiss Re — Public Sector Solutions",
      "cat": "carrier",
      "country": "CH",
      "why": "Most active reinsurer in sovereign and public-sector parametric structures.",
      "ask": "Technical review of trigger design; appetite for a collateralised layer.",
      "stage": "identified",
      "owner": "",
      "contact": "",
      "next": "Research the right entry point and warm intro path",
      "nextDate": "",
      "notes": "",
      "seeded": true
    },
    {
      "id": "p02",
      "name": "Munich Re",
      "cat": "carrier",
      "country": "DE",
      "why": "Deep catastrophe and infrastructure book; existing parametric capability.",
      "ask": "Underwriting view and indicative pricing range.",
      "stage": "identified",
      "owner": "",
      "contact": "",
      "next": "Research the right entry point and warm intro path",
      "nextDate": "",
      "notes": "",
      "seeded": true
    },
    {
      "id": "p03",
      "name": "Hannover Re",
      "cat": "carrier",
      "country": "DE",
      "why": "Active in structured and non-traditional reinsurance solutions.",
      "ask": "Appetite for a structured, response-linked layer.",
      "stage": "identified",
      "owner": "",
      "contact": "",
      "next": "Research the right entry point and warm intro path",
      "nextDate": "",
      "notes": "",
      "seeded": true
    },
    {
      "id": "p04",
      "name": "AXA Climate",
      "cat": "carrier",
      "country": "FR",
      "why": "Purpose-built for parametric and climate-linked covers.",
      "ask": "Co-design of the parametric component.",
      "stage": "identified",
      "owner": "",
      "contact": "",
      "next": "Research the right entry point and warm intro path",
      "nextDate": "",
      "notes": "",
      "seeded": true
    },
    {
      "id": "p05",
      "name": "Guy Carpenter",
      "cat": "carrier",
      "country": "UK",
      "why": "Broker and structurer with public-sector risk practice.",
      "ask": "Placement advice and access to carrier appetite.",
      "stage": "identified",
      "owner": "",
      "contact": "",
      "next": "Research the right entry point and warm intro path",
      "nextDate": "",
      "notes": "",
      "seeded": true
    },
    {
      "id": "p06",
      "name": "Aon — Reinsurance Solutions",
      "cat": "carrier",
      "country": "UK",
      "why": "Broker with strong DRF and public-sector team.",
      "ask": "Structuring support and market sounding.",
      "stage": "identified",
      "owner": "",
      "contact": "",
      "next": "Research the right entry point and warm intro path",
      "nextDate": "",
      "notes": "",
      "seeded": true
    },
    {
      "id": "p10",
      "name": "Fermat Capital Management",
      "cat": "capital",
      "country": "US",
      "why": "One of the largest dedicated ILS managers.",
      "ask": "Investability read and indicative appetite.",
      "stage": "identified",
      "owner": "",
      "contact": "",
      "next": "Research the right entry point and warm intro path",
      "nextDate": "",
      "notes": "",
      "seeded": true
    },
    {
      "id": "p11",
      "name": "Twelve Capital",
      "cat": "capital",
      "country": "CH",
      "why": "ILS manager active in private and structured transactions.",
      "ask": "View on wrapper and minimum size.",
      "stage": "identified",
      "owner": "",
      "contact": "",
      "next": "Research the right entry point and warm intro path",
      "nextDate": "",
      "notes": "",
      "seeded": true
    },
    {
      "id": "p12",
      "name": "Schroders Capital — ILS",
      "cat": "capital",
      "country": "CH",
      "why": "Institutional ILS platform with impact-oriented mandates.",
      "ask": "Mandate fit for a purpose-linked instrument.",
      "stage": "identified",
      "owner": "",
      "contact": "",
      "next": "Research the right entry point and warm intro path",
      "nextDate": "",
      "notes": "",
      "seeded": true
    },
    {
      "id": "p13",
      "name": "Blue Marble",
      "cat": "capital",
      "country": "CH",
      "why": "Consortium focused on protection for underserved risks.",
      "ask": "Partnership on sponsored-protection design.",
      "stage": "identified",
      "owner": "",
      "contact": "",
      "next": "Research the right entry point and warm intro path",
      "nextDate": "",
      "notes": "",
      "seeded": true
    },
    {
      "id": "p20",
      "name": "Rockefeller Foundation",
      "cat": "donor",
      "country": "US",
      "why": "Funds resilience and climate-adaptation infrastructure.",
      "ask": "Grant funding for facility design and first premium.",
      "stage": "identified",
      "owner": "",
      "contact": "",
      "next": "Research the right entry point and warm intro path",
      "nextDate": "",
      "notes": "",
      "seeded": true
    },
    {
      "id": "p21",
      "name": "Z Zurich Foundation",
      "cat": "donor",
      "country": "CH",
      "why": "Long-standing flood and climate resilience programme.",
      "ask": "Premium support and technical partnership.",
      "stage": "identified",
      "owner": "",
      "contact": "",
      "next": "Research the right entry point and warm intro path",
      "nextDate": "",
      "notes": "",
      "seeded": true
    },
    {
      "id": "p22",
      "name": "UK FCDO",
      "cat": "donor",
      "country": "UK",
      "why": "Funds disaster risk financing across South Asia.",
      "ask": "Programme fit and concept-note route.",
      "stage": "identified",
      "owner": "",
      "contact": "",
      "next": "Research the right entry point and warm intro path",
      "nextDate": "",
      "notes": "",
      "seeded": true
    },
    {
      "id": "p23",
      "name": "Start Network",
      "cat": "donor",
      "country": "UK",
      "why": "Pioneer of anticipatory action and crisis financing.",
      "ask": "Design input on anticipatory triggers; possible co-funding.",
      "stage": "identified",
      "owner": "",
      "contact": "",
      "next": "Research the right entry point and warm intro path",
      "nextDate": "",
      "notes": "",
      "seeded": true
    },
    {
      "id": "p30",
      "name": "Asian Development Bank",
      "cat": "dfi",
      "country": "PH",
      "why": "Principal DFI in Sri Lanka; active DRF portfolio.",
      "ask": "Technical partnership and route into the country DRF programme.",
      "stage": "identified",
      "owner": "",
      "contact": "",
      "next": "Research the right entry point and warm intro path",
      "nextDate": "",
      "notes": "",
      "seeded": true
    },
    {
      "id": "p31",
      "name": "World Bank / GFDRR",
      "cat": "dfi",
      "country": "US",
      "why": "Global DRF standard-setter; Sri Lanka country programme.",
      "ask": "Technical review and possible co-financing path.",
      "stage": "identified",
      "owner": "",
      "contact": "",
      "next": "Research the right entry point and warm intro path",
      "nextDate": "",
      "notes": "",
      "seeded": true
    },
    {
      "id": "p32",
      "name": "IFC",
      "cat": "dfi",
      "country": "US",
      "why": "Private-sector arm; infrastructure and digital investment.",
      "ask": "View on operator-side counterparty structure.",
      "stage": "identified",
      "owner": "",
      "contact": "",
      "next": "Research the right entry point and warm intro path",
      "nextDate": "",
      "notes": "",
      "seeded": true
    },
    {
      "id": "p33",
      "name": "Global Shield against Climate Risks",
      "cat": "dfi",
      "country": "DE",
      "why": "Financing vehicle for pre-arranged climate risk finance.",
      "ask": "Eligibility of the facility for Global Shield support.",
      "stage": "identified",
      "owner": "",
      "contact": "",
      "next": "Research the right entry point and warm intro path",
      "nextDate": "",
      "notes": "",
      "seeded": true
    },
    {
      "id": "p34",
      "name": "InsuResilience Global Partnership",
      "cat": "dfi",
      "country": "DE",
      "why": "Convening body for climate risk insurance.",
      "ask": "Visibility, endorsement and partner introductions.",
      "stage": "identified",
      "owner": "",
      "contact": "",
      "next": "Research the right entry point and warm intro path",
      "nextDate": "",
      "notes": "",
      "seeded": true
    },
    {
      "id": "p40",
      "name": "Dialog Axiata",
      "cat": "operator",
      "country": "LK",
      "why": "Largest mobile operator in Sri Lanka; extensive network telemetry.",
      "ask": "Restoration cost data, telemetry access under NDA, MoU on response commitments.",
      "stage": "identified",
      "owner": "",
      "contact": "",
      "next": "Research the right entry point and warm intro path",
      "nextDate": "",
      "notes": "",
      "seeded": true
    },
    {
      "id": "p41",
      "name": "SLT-Mobitel",
      "cat": "operator",
      "country": "LK",
      "why": "State-linked incumbent; fixed and mobile critical infrastructure.",
      "ask": "Restoration cost experience and emergency obligations discussion.",
      "stage": "identified",
      "owner": "",
      "contact": "",
      "next": "Research the right entry point and warm intro path",
      "nextDate": "",
      "notes": "",
      "seeded": true
    },
    {
      "id": "p42",
      "name": "Airtel Lanka",
      "cat": "operator",
      "country": "LK",
      "why": "Third operator; useful for cross-network coverage design.",
      "ask": "Interest in shared emergency capacity arrangements.",
      "stage": "identified",